{"type":"config","name":"Next.js compat test audit (issue #204)","metricName":"passing_compat_tests","metricUnit":"","bestDirection":"higher"}
{"run":1,"commit":"5fdfb94","metric":21,"metrics":{"test_files":21,"dirs_covered":13,"skipped_tests":2},"status":"crash","description":"Baseline attempt — metric extraction bug: grep grabbed test file count (21) instead of test case count (233). Fixing autoresearch.sh.","timestamp":1773769998861,"segment":0}
{"run":2,"commit":"5b5b084","metric":233,"metrics":{"test_files":21,"dirs_covered":13,"skipped_tests":2},"status":"keep","description":"Baseline: 233 passing compat tests, 21 files, 13 dirs covered. Fixed autoresearch.sh ANSI stripping.","timestamp":1773770284151,"segment":0}
{"run":3,"commit":"129b6ed","metric":236,"metrics":{"test_files":22,"dirs_covered":14,"skipped_tests":2},"status":"keep","description":"Port app-fetch-deduping-errors: 3 tests for page rendering despite fetch errors in generateMetadata and page component","timestamp":1773770616832,"segment":0}
{"run":4,"commit":"129b6ed","metric":236,"metrics":{"test_files":22,"dirs_covered":14,"skipped_tests":2},"status":"discard","description":"Skip app-invalid-revalidate: build-time validation test requiring file patching + server restart + CLI output checks. Not feasible with fetchHtml pattern.","timestamp":1773770652725,"segment":0}
{"run":5,"commit":"9342d34","metric":241,"metrics":{"test_files":23,"dirs_covered":15,"skipped_tests":2},"status":"keep","description":"Port forbidden: 5 tests for forbidden() boundary, 403 status, scoped + root escalation. Also triaged 6 P1 dirs as skip (Playwright/CLI/build-specific).","timestamp":1773771035161,"segment":0}
{"run":6,"commit":"17473c7","metric":246,"metrics":{"test_files":24,"dirs_covered":16,"skipped_tests":2},"status":"keep","description":"Port unauthorized: 5 tests for unauthorized() boundary, 401 status, scoped + root escalation. Skip proxy-missing-export (covered by PR #203).","timestamp":1773771265929,"segment":0}
{"run":7,"commit":"59bd8bc","metric":249,"metrics":{"test_files":25,"dirs_covered":17,"skipped_tests":2},"status":"keep","description":"Port catch-all-optional: 3 tests for optional catch-all routing. Batch-triage 14 more P1+P2 dirs as skip. 249 total tests.","timestamp":1773771569544,"segment":0}
{"run":8,"commit":"5a03d6d","metric":251,"metrics":{"test_files":26,"dirs_covered":18,"skipped_tests":2},"status":"keep","description":"Port simple-routes + FIX BUG: route handlers received plain Request instead of NextRequest (.nextUrl undefined). Wrapped in NextRequest in app-rsc-entry.ts.","timestamp":1773771877667,"segment":0}
{"run":9,"commit":"3979dbe","metric":254,"metrics":{"test_files":27,"dirs_covered":19,"skipped_tests":2},"status":"keep","description":"Port rsc-redirect: 3 tests for redirect() from server component. Found RSC redirect behavioral difference (307 vs 200+stream). Triage 4 more dirs.","timestamp":1773772144313,"segment":0}
{"run":10,"commit":"bff4433","metric":259,"metrics":{"test_files":28,"dirs_covered":20,"skipped_tests":2},"status":"keep","description":"Port static-generation-status: 5 tests for notFound/redirect/permanentRedirect status codes + client component redirect SSR. Triage 5 more dirs.","timestamp":1773772442563,"segment":0}
{"run":11,"commit":"bff4433","metric":259,"metrics":{"test_files":28,"dirs_covered":20,"skipped_tests":2},"status":"discard","description":"Triage-only: batch-skipped 33 more P2/P3 dirs (parallel routes, interception, middleware, complex fixtures). 148/379 audited (39.1%).","timestamp":1773772713165,"segment":0}
{"run":12,"commit":"baf1790","metric":265,"metrics":{"test_files":29,"dirs_covered":21,"skipped_tests":2},"status":"keep","description":"Port layout-params: 6 tests. BUG FOUND+FIXED: layouts received ALL params instead of scoped per-segment params. Fixed 4 rendering loops in app-rsc-entry.ts + buildPageElement. Added cheerio + fetchDom helper.","timestamp":1773775207975,"segment":0}
{"run":13,"commit":"799d950","metric":275,"metrics":{"test_files":30,"dirs_covered":22,"skipped_tests":2},"status":"keep","description":"Port metadata-dynamic-routes: 10 tests for robots.txt, sitemap.xml (alternates/images/videos), manifest.webmanifest, icon.tsx file convention routes.","timestamp":1773775516422,"segment":0}
{"run":14,"commit":"8a32893","metric":280,"metrics":{"test_files":31,"dirs_covered":23,"skipped_tests":2},"status":"keep","description":"Port searchparams-static-bailout: 5 tests for searchParams in server/client components, passthrough from server→client, and no-use pages. Triage 2 more dirs.","timestamp":1773775749804,"segment":0}
{"run":15,"commit":"3ebe0e4","metric":285,"metrics":{"test_files":33,"dirs_covered":25,"skipped_tests":2},"status":"keep","description":"Port use-params (3 tests: useParams SSR for single/nested/catchall) + conflicting-search-and-route-params (2 tests: same-name route vs search param). Triage 3 more dirs.","timestamp":1773776063150,"segment":0}
{"run":16,"commit":"bee5680","metric":288,"metrics":{"test_files":34,"dirs_covered":26,"skipped_tests":2},"status":"keep","description":"Port _allow-underscored-root-directory: 3 tests using dedicated fixture. Added APP_UNDERSCORED_ROOT_FIXTURE_DIR and a minimal fixture to verify private underscore folders are hidden while %5F-decoded folders remain routable.","timestamp":1773777133380,"segment":0}
{"run":17,"commit":"3675a4b","metric":290,"metrics":{"test_files":35,"dirs_covered":27,"skipped_tests":2},"status":"keep","description":"Port use-cache-route-handler-only: 2 tests using a dedicated route-handler-only fixture. Verified function-level \"use cache\" in route handlers and revalidatePath() invalidation without any pages present.","timestamp":1773777374052,"segment":0}
{"run":18,"commit":"b016176","metric":294,"metrics":{"test_files":36,"dirs_covered":28,"skipped_tests":2},"status":"keep","description":"Port dynamic-data: 4 dev-mode HTTP tests for top-level, force-dynamic, force-static, and client-page request API usage. BUG FOUND+FIXED: force-static pages leaked real searchParams instead of empty object.","timestamp":1773777740422,"segment":0}
{"run":19,"commit":"070e7d9","metric":296,"metrics":{"test_files":37,"dirs_covered":29,"skipped_tests":2},"status":"keep","description":"Port rewrites-redirects: 2 pure-HTTP tests for exotic URL-scheme redirects in next.config (itms-apps with and without //).","timestamp":1773777918981,"segment":0}
{"run":20,"commit":"070e7d9","metric":298,"metrics":{"test_files":38,"dirs_covered":29,"skipped_tests":2},"status":"discard","description":"Discard app-basepath attempt. Targeted tests exposed real compat gaps (exact /base 404s in dev; static metadata file routes are served but not injected into <head>) and also revealed a harness bug: autoresearch.sh falsely treats partial failures as success because it only checks for 'passed' in Vitest summary. Reverting code; ideas preserved.","timestamp":1773778486934,"segment":0}
{"run":21,"commit":"0efb654","metric":296,"metrics":{"test_files":37,"dirs_covered":29,"skipped_tests":2},"status":"keep","description":"Fix benchmark harness: autoresearch.sh now checks Vitest exit code instead of grepping for 'passed', preventing false positives when some compat tests fail. Metric unchanged but benchmark correctness improved.","timestamp":1773778658744,"segment":0}
{"run":22,"commit":"fbfb261","metric":298,"metrics":{"test_files":38,"dirs_covered":30,"skipped_tests":2},"status":"keep","description":"Port app-routes-trailing-slash: 2 tests using dedicated trailingSlash fixture. Verified route handlers redirect to slash-canonical URLs and preserve the slash in both url.pathname and req.nextUrl.pathname.","timestamp":1773778917358,"segment":0}
{"run":23,"commit":"fbfb261","metric":0,"metrics":{"test_files":0,"dirs_covered":30,"skipped_tests":2},"status":"crash","description":"Crash on dynamic-requests attempt. Adding dead-code require(value)/import(value) patterns to shared app-basic fixture caused broad compat-suite failures because vite-plugin-commonjs rejects them during transform, even when unreachable. Recorded as a follow-up in autoresearch.ideas.md; reverting code.","timestamp":1773779141117,"segment":0}
{"run":24,"commit":"9fb39a9","metric":301,"metrics":{"test_files":39,"dirs_covered":31,"skipped_tests":2},"status":"keep","description":"Port not-found-default HTTP subset (3 tests) with a dedicated fixture. Fixed a real runtime gap: default 404 pages now fall back to next/error and stay wrapped in root/ancestor layouts when no explicit not-found.tsx exists.","timestamp":1773779687704,"segment":0}
